{
  "kind": "m6",
  "schema_version": 1,
  "timestamp": "2026-10-07T07:12:00Z",
  "environment": {
    "scope": "M6 provider qualification and controlled handoff baseline across Claude, Codex, Pi, and Antigravity. Authentic provider accounts, platform matrices, and physical hardware remain unexecuted prerequisites.",
    "os": "linux",
    "arch": "x86_64",
    "sdk_id": "studio-sdk-x86_64-unknown-linux-gnu-v2",
    "sdk_manifest_sha256": "f800212e456dbb911ec7be55dcc674b73bc86e7f5f52f6faf619f57ea87c11ba"
  },
  "providers": {
    "claude": {
      "id": "claude",
      "label": "Claude",
      "distribution": "unresolved (research candidate: @agentclientprotocol/claude-agent-acp)",
      "upstream_version": "unresolved",
      "auth_route": "ANTHROPIC_API_KEY environment variable or interactive terminal login",
      "mcp_route": "stdio",
      "status": "not_run",
      "prerequisites": "Authenticated Anthropic account with active API credit and operator verification.",
      "probe_observation": {
        "status": "missing_executable",
        "detail": "Adapter executable 'claude-agent-acp' not found in managed search directories or configured path.",
        "runtime_available": null,
        "observed_unix_seconds": 1791335934,
        "searched": [
          "adapters/claude-agent-acp"
        ],
        "evidence": {
          "path": "evidence/m6-probes/probe-claude.json",
          "sha256": "be89f0968c29998cb0a29908332c9f575e65179766f2c3d777b8bbca87d26142"
        }
      },
      "capabilities": null,
      "gates": {
        "create_edit_export": {
          "kind": "authentic",
          "status": "not_run",
          "criteria": "Performs create, selected title edit, inspect/preview, Apply, second edit, Undo, reopen, and CLI backend export from immutable revision.",
          "notes": "Authentic Claude workflow run not yet executed.",
          "prerequisite": "Operator authenticated Claude account and managed SDK test environment."
        },
        "selected_context_edit": {
          "kind": "authentic",
          "status": "not_run",
          "criteria": "Applies edits bound to frozen element, rectangle, scene, and range scopes without altering outside code.",
          "notes": "Authentic Claude scope run not yet executed.",
          "prerequisite": "Operator authenticated Claude account and managed SDK test environment."
        },
        "compiler_error_repair": {
          "kind": "authentic",
          "status": "not_run",
          "criteria": "Detects compiler diagnostics and completes autonomous repair within a single automatic retry budget.",
          "notes": "Authentic Claude error repair run not yet executed.",
          "prerequisite": "Operator authenticated Claude account and managed SDK test environment."
        },
        "completion_and_streaming": {
          "kind": "authentic",
          "status": "not_run",
          "criteria": "Maintains streaming chunk responsiveness, follow-up questions, and clean turn boundary quiescence.",
          "notes": "Authentic Claude streaming run not yet executed.",
          "prerequisite": "Operator authenticated Claude account and managed SDK test environment."
        },
        "permission_and_errors": {
          "kind": "authentic",
          "status": "not_run",
          "criteria": "Responds correctly to user approve/decline requests and handles protocol errors without deadlocking.",
          "notes": "Authentic Claude permission run not yet executed.",
          "prerequisite": "Operator authenticated Claude account and managed SDK test environment."
        },
        "interruption_and_cleanup": {
          "kind": "authentic",
          "status": "not_run",
          "criteria": "Enforces verified process group termination on user Stop or adapter crash with zero escaped descendants.",
          "notes": "Authentic Claude process containment run not yet executed.",
          "prerequisite": "Operator authenticated Claude account and managed SDK test environment."
        },
        "restoration_and_fallback": {
          "kind": "authentic",
          "status": "not_run",
          "criteria": "Resumes eligible session at identical draft cwd with fresh capability grants, falling back to new session when unsupported.",
          "notes": "Authentic Claude session restoration run not yet executed.",
          "prerequisite": "Operator authenticated Claude account and managed SDK test environment."
        },
        "tool_parity": {
          "kind": "authentic",
          "status": "not_run",
          "criteria": "Executes all nine Studio tools through advertised stdio MCP route with hash-verified outputs.",
          "notes": "Authentic Claude MCP tool dispatch run not yet executed.",
          "prerequisite": "Operator authenticated Claude account and managed SDK test environment."
        },
        "image_context": {
          "kind": "authentic",
          "status": "not_run",
          "criteria": "Verifies bounded PNG image context with hidden visual property check or honest text fallback.",
          "notes": "Authentic Claude image context run not yet executed.",
          "prerequisite": "Operator authenticated Claude account and managed SDK test environment."
        },
        "twenty_cycle_cleanup": {
          "kind": "authentic",
          "status": "not_run",
          "criteria": "Survives twenty consecutive edit, cancel, and reopen cycles within RSS and process tree bounds.",
          "notes": "Authentic Claude multi-cycle stress run not yet executed.",
          "prerequisite": "Operator authenticated Claude account and managed SDK test environment."
        },
        "controlled_handoff": {
          "kind": "authentic",
          "status": "not_run",
          "criteria": "Demonstrates safe stopped-writer handoff to peer provider preserving accepted and unsaved draft variants.",
          "notes": "Authentic Claude handoff run not yet executed.",
          "prerequisite": "Operator authenticated Claude account and passing peer provider."
        },
        "platform_linux": {
          "kind": "authentic",
          "status": "not_run",
          "criteria": "Authentic execution verified on Linux x86_64 platform.",
          "notes": "Authentic Claude Linux run not yet executed.",
          "prerequisite": "Operator authenticated Claude account on native Linux host."
        },
        "platform_windows": {
          "kind": "authentic",
          "status": "blocked",
          "criteria": "Authentic execution verified on Windows platform.",
          "notes": "A Windows Server 2022 development host now passes the desktop workspace suite and packaged-app smoke (m0-results.json additional_platforms), but this provider's ACP adapter was not installed or authenticated there.",
          "prerequisite": "Windows physical or virtual machine runner with native adapter runtime."
        },
        "platform_macos": {
          "kind": "authentic",
          "status": "blocked",
          "criteria": "Authentic execution verified on macOS platform.",
          "notes": "No macOS test host configured in current environment.",
          "prerequisite": "macOS physical or virtual machine runner with native adapter runtime."
        },
        "platform_physical_device": {
          "kind": "authentic",
          "status": "blocked",
          "criteria": "Authentic execution verified on physical display, audio, and input devices.",
          "notes": "Headless CI environment without physical display/audio hardware.",
          "prerequisite": "Physical hardware test bench with display, audio, and input devices."
        }
      }
    },
    "codex": {
      "id": "codex",
      "label": "Codex",
      "distribution": "unresolved (research candidate: @agentclientprotocol/codex-acp)",
      "upstream_version": "unresolved",
      "auth_route": "OPENAI_API_KEY / CODEX_API_KEY environment variables or ChatGPT browser login",
      "mcp_route": "stdio",
      "status": "not_run",
      "prerequisites": "Authenticated OpenAI Codex account with active API credit and server verification.",
      "probe_observation": {
        "status": "missing_executable",
        "detail": "Adapter executable 'codex-acp' not found in managed search directories or configured path.",
        "runtime_available": null,
        "observed_unix_seconds": 1791335934,
        "searched": [
          "adapters/codex-acp"
        ],
        "evidence": {
          "path": "evidence/m6-probes/probe-codex.json",
          "sha256": "e0f70b2a92439ff57f589e3fef600ddd93b776c74766fdcead52eae44d1b6497"
        }
      },
      "capabilities": null,
      "gates": {
        "create_edit_export": {
          "kind": "authentic",
          "status": "not_run",
          "criteria": "Performs create, selected title edit, inspect/preview, Apply, second edit, Undo, reopen, and CLI backend export from immutable revision.",
          "notes": "Authentic Codex workflow run not yet executed.",
          "prerequisite": "Operator authenticated Codex account and managed SDK test environment."
        },
        "selected_context_edit": {
          "kind": "authentic",
          "status": "not_run",
          "criteria": "Applies edits bound to frozen element, rectangle, scene, and range scopes without altering outside code.",
          "notes": "Authentic Codex scope run not yet executed.",
          "prerequisite": "Operator authenticated Codex account and managed SDK test environment."
        },
        "compiler_error_repair": {
          "kind": "authentic",
          "status": "not_run",
          "criteria": "Detects compiler diagnostics and completes autonomous repair within a single automatic retry budget.",
          "notes": "Authentic Codex error repair run not yet executed.",
          "prerequisite": "Operator authenticated Codex account and managed SDK test environment."
        },
        "completion_and_streaming": {